{"artifact":{"batchIndex":0,"channels":3,"declaredSourceBitDepth":null,"encodedSampleBits":8,"fileName":"complete_record_v1.png","fileSizeBytes":12345,"format":"png","hasAlpha":false,"height":768,"incomingTensorDtype":"float32","measuredEffectiveBitDepth":null,"metadataStatus":"complete","mimeType":"image/png","mode":"RGB","precisionConversionReason":"pillow_writer_boundary","precisionConverted":true,"sidecarFileName":"complete_record_v1.json","subfolder":"samples","width":1024},"generationRecord":{"diagnostics":{"errors":[],"warnings":[]},"generator":{"comfyuiVersion":"0.3.50","name":"CCollins' CiviScribe","version":"2.0.0-test"},"image":{"batchIndex":0,"format":"png","height":768,"width":1024},"primaryResourceKey":"1:unet_name","prompts":{"negative":{"branchPresent":true,"candidates":[],"sourceNodeIds":["11"],"text":"low quality, watermark"},"positive":{"branchPresent":true,"candidates":[],"sourceNodeIds":["10"],"text":"portrait of café 雪\ncinematic light"}},"resources":[{"active":true,"detectionRuleId":"unet_loader","filename":"swiftFastAndDetailed_neo.gguf","hashStatus":"not_attempted","hashes":{"AutoV1":"1234abcd","AutoV2":"1234567890","AutoV3":"123456789abc","BLAKE3":"bbbbbbbbbbbbbbbbbbbbbbbbbbbbbbbbbbbbbbbbbbbbbbbbbbbbbbbbbbbbbbbb","CRC32":"abcdef12","SHA256":"1234567890aaaaaaaaaaaaaaaaaaaaaaaaaaaaaaaaaaaaaaaaaaaaaaaaaaaaaa"},"identity":{"airSource":"civitai","baseModel":null,"canonicalAir":"urn:air:flux2:checkpoint:civitai:2432159@2734704+2402203.safetensor","ecosystem":"flux2","fileId":"2402203","filePrimary":null,"fileType":null,"format":"safetensor","id":"2432159","modelId":2432159,"modelName":"SWIFT! Fast and detailed ZIT model","modelVersionId":2734704,"modelVersionName":"NEO","rawAir":"urn:air:flux2:checkpoint:civitai:2432159@2734704+2402203.safetensor","source":"api","type":"checkpoint","version":"2734704"},"identityScope":"exact_file","key":"1:unet_name","lookupDiagnostics":{"attemptedHashTypes":[],"candidateCount":null,"compatibleCandidateCount":null,"httpStatus":null,"reason":null,"retryAfterSeconds":null,"retryable":null,"status":"not_attempted","tlsSource":null},"lookupStatus":"not_attempted","nodeClass":"UnetLoaderGGUF","nodeId":"1","parserExclusionReason":null,"parserFacing":true,"resolved":true,"role":"base_model","selectedValue":"diffusion_models/swiftFastAndDetailed_neo.gguf","status":"resolved","strengths":{"clip":null,"model":null,"weight":null},"type":"diffusion_model","unresolvedReason":null},{"active":true,"detectionRuleId":"lora_loader","filename":"ProjectRealismPhotoLora_v1.safetensors","hashStatus":"not_attempted","hashes":{"AutoV1":null,"AutoV2":"1111111111","AutoV3":null,"BLAKE3":null,"CRC32":null,"SHA256":null},"identity":{"airSource":"civitai","baseModel":null,"canonicalAir":"urn:air:flux2:lora:civitai:400@401+402.safetensor","ecosystem":"flux2","fileId":"402","filePrimary":null,"fileType":null,"format":"safetensor","id":"400","modelId":400,"modelName":"Project Realism Photo","modelVersionId":401,"modelVersionName":"v1","rawAir":"urn:air:flux2:lora:civitai:400@401+402.safetensor","source":"api","type":"lora","version":"401"},"identityScope":"exact_file","key":"2:lora_name","lookupDiagnostics":{"attemptedHashTypes":[],"candidateCount":null,"compatibleCandidateCount":null,"httpStatus":null,"reason":null,"retryAfterSeconds":null,"retryable":null,"status":"not_attempted","tlsSource":null},"lookupStatus":"not_attempted","nodeClass":"LoraLoader","nodeId":"2","parserExclusionReason":null,"parserFacing":true,"resolved":true,"role":"lora","selectedValue":"loras/ProjectRealismPhotoLora_v1.safetensors","status":"resolved","strengths":{"clip":0.6,"model":0.8,"weight":0.75},"type":"lora","unresolvedReason":null},{"active":true,"detectionRuleId":"embedding_loader","filename":"detailer.pt","hashStatus":"not_attempted","hashes":{"AutoV1":null,"AutoV2":"2222222222","AutoV3":null,"BLAKE3":null,"CRC32":null,"SHA256":null},"identity":{"airSource":"civitai","baseModel":null,"canonicalAir":"urn:air:flux2:embedding:civitai:500@501+502.pt","ecosystem":"flux2","fileId":"502","filePrimary":null,"fileType":null,"format":"safetensor","id":"500","modelId":500,"modelName":"Detailer","modelVersionId":501,"modelVersionName":"v1","rawAir":"urn:air:flux2:embedding:civitai:500@501+502.pt","source":"api","type":"embedding","version":"501"},"identityScope":"exact_file","key":"3:embedding","lookupDiagnostics":{"attemptedHashTypes":[],"candidateCount":null,"compatibleCandidateCount":null,"httpStatus":null,"reason":null,"retryAfterSeconds":null,"retryable":null,"status":"not_attempted","tlsSource":null},"lookupStatus":"not_attempted","nodeClass":"EmbeddingLoader","nodeId":"3","parserExclusionReason":null,"parserFacing":true,"resolved":true,"role":"embedding","selectedValue":"embeddings/detailer.pt","status":"resolved","strengths":{"clip":null,"model":null,"weight":null},"type":"embedding","unresolvedReason":null},{"active":true,"detectionRuleId":"vae_loader","filename":"ae.safetensors","hashStatus":"not_attempted","hashes":{"AutoV1":null,"AutoV2":"abcdef1234","AutoV3":null,"BLAKE3":null,"CRC32":null,"SHA256":null},"identity":{"airSource":"civitai","baseModel":null,"canonicalAir":"urn:air:flux2:vae:civitai:300@301+302.safetensor","ecosystem":"flux2","fileId":"302","filePrimary":null,"fileType":null,"format":"safetensor","id":"300","modelId":300,"modelName":"Flux VAE","modelVersionId":301,"modelVersionName":"ae","rawAir":"urn:air:flux2:vae:civitai:300@301+302.safetensor","source":"api","type":"vae","version":"301"},"identityScope":"exact_file","key":"5:vae_name","lookupDiagnostics":{"attemptedHashTypes":[],"candidateCount":null,"compatibleCandidateCount":null,"httpStatus":null,"reason":null,"retryAfterSeconds":null,"retryable":null,"status":"not_attempted","tlsSource":null},"lookupStatus":"not_attempted","nodeClass":"VAELoader","nodeId":"5","parserExclusionReason":null,"parserFacing":true,"resolved":true,"role":"vae","selectedValue":"vae/ae.safetensors","status":"resolved","strengths":{"clip":null,"model":null,"weight":null},"type":"vae","unresolvedReason":null}],"selectedVaeResourceKey":"5:vae_name","settings":{"batchSize":1,"cfgScale":7.0,"clipSkip":2,"denoise":0.75,"guidance":null,"height":768,"sampler":"dpmpp_2m","scheduler":"karras","seed":123456789,"steps":20,"width":1024},"workflowType":"txt2img"},"payloads":{"prompt":{"6":{"class_type":"KSampler","inputs":{"seed":123456789}}},"workflow":{"nodes":[{"id":6,"type":"KSampler"}]}},"projections":{"civitai":{"civitaiResources":[{"air":"urn:air:flux2:checkpoint:civitai:2432159@2734704+2402203.safetensor","fileId":"2402203","format":"safetensor","modelId":2432159,"modelName":"SWIFT! Fast and detailed ZIT model","modelVersionId":2734704,"modelVersionName":"NEO","type":"checkpoint","urn":"urn:air:flux2:checkpoint:civitai:2432159@2734704+2402203.safetensor"},{"air":"urn:air:flux2:lora:civitai:400@401+402.safetensor","fileId":"402","format":"safetensor","modelId":400,"modelName":"Project Realism Photo","modelVersionId":401,"modelVersionName":"v1","strengthClip":0.6,"strengthModel":0.8,"type":"lora","urn":"urn:air:flux2:lora:civitai:400@401+402.safetensor","weight":0.75},{"air":"urn:air:flux2:embedding:civitai:500@501+502.pt","fileId":"502","format":"safetensor","modelId":500,"modelName":"Detailer","modelVersionId":501,"modelVersionName":"v1","type":"embedding","urn":"urn:air:flux2:embedding:civitai:500@501+502.pt"},{"air":"urn:air:flux2:vae:civitai:300@301+302.safetensor","fileId":"302","format":"safetensor","modelId":300,"modelName":"Flux VAE","modelVersionId":301,"modelVersionName":"ae","type":"vae","urn":"urn:air:flux2:vae:civitai:300@301+302.safetensor"}],"generation":{"batchIndex":0,"batchSize":1,"cfgScale":7.0,"clipSkip":2,"denoise":null,"guidance":null,"height":768,"model":"swiftFastAndDetailed_neo.gguf","modelHash":"1234567890","sampler":"DPM++ 2M","scheduler":"Karras","seed":123456789,"steps":20,"vae":"ae.safetensors","vaeHash":"abcdef1234","width":1024,"workflowType":"txt2img"},"generator":{"comfyuiVersion":"0.3.50","name":"CCollins' CiviScribe","version":"2.0.0-test"},"hashes":{"LORA:ProjectRealismPhotoLora_v1.safetensors":"1111111111","VAE:ae.safetensors":"abcdef1234","embed:detailer.pt":"2222222222","lora:ProjectRealismPhotoLora_v1.safetensors":"1111111111","model":"1234567890","model:swiftFastAndDetailed_neo.gguf":"1234567890","vae":"abcdef1234","vae:ae.safetensors":"abcdef1234"},"image":{"batchIndex":0,"format":"png","height":768,"width":1024},"metadataStatus":"complete","primaryResourceKey":"1:unet_name","prompt":{"negative":"low quality, watermark","negativeBranchPresent":true,"positive":"portrait of café 雪\ncinematic light","positiveBranchPresent":true},"resources":[{"active":true,"detectionRuleId":"unet_loader","filename":"swiftFastAndDetailed_neo.gguf","hashStatus":"not_attempted","hashes":{"AutoV1":"1234abcd","AutoV2":"1234567890","AutoV3":"123456789abc","BLAKE3":"bbbbbbbbbbbbbbbbbbbbbbbbbbbbbbbbbbbbbbbbbbbbbbbbbbbbbbbbbbbbbbbb","CRC32":"abcdef12","SHA256":"1234567890aaaaaaaaaaaaaaaaaaaaaaaaaaaaaaaaaaaaaaaaaaaaaaaaaaaaaa"},"identity":{"airSource":"civitai","baseModel":null,"canonicalAir":"urn:air:flux2:checkpoint:civitai:2432159@2734704+2402203.safetensor","ecosystem":"flux2","fileId":"2402203","filePrimary":null,"fileType":null,"format":"safetensor","id":"2432159","modelId":2432159,"modelName":"SWIFT! Fast and detailed ZIT model","modelVersionId":2734704,"modelVersionName":"NEO","rawAir":"urn:air:flux2:checkpoint:civitai:2432159@2734704+2402203.safetensor","source":"api","type":"checkpoint","version":"2734704"},"identityScope":"exact_file","key":"1:unet_name","lookupDiagnostics":{"attemptedHashTypes":[],"candidateCount":null,"compatibleCandidateCount":null,"httpStatus":null,"reason":null,"retryAfterSeconds":null,"retryable":null,"status":"not_attempted","tlsSource":null},"lookupStatus":"not_attempted","nodeClass":"UnetLoaderGGUF","nodeId":"1","parserExclusionReason":null,"parserFacing":true,"resolved":true,"role":"base_model","selectedValue":"diff